{
  "$schema": "https://json-schema.org/draft/2020-12/schema",
  "$id": "https://vibe-code-genius.dev/schema/intent.schema.json",
  "title": "intent",
  "type": "object",
  "additionalProperties": true,
  "properties": {
    "status": { "type": "string" },
    "version": { "type": "string" },
    "product_name": { "type": "string" },
    "product_type": { "type": "string" },
    "target_user": { "type": "string" },
    "key_flows": { "type": "array" },
    "reference_url": { "type": ["string", "null"] },
    "vibe": { "type": "string" },
    "evidence": { "type": "array", "items": { "type": "string" } }
  }
}
